{"annihilation_conditions":[{"candidate_set":["build_configuration","bundled_installer"],"target":"php_installation","workload_id":"bundled-install-requires-builder"}],"artifact_hash":"sha256:b2805ea0e35de4c23dcadc06a1e431c61ab7d03560976878f848f0daa9bd501f","artifact_schema_version":"dependency-algebra.artifact.v1","classification":"DEGRADED","compiler_version":"dependency-algebra.compiler.v1","dependency_lattice":[{"candidate_set":["build_configuration","bundled_installer"],"dependency":true,"dependency_reason":"no_structurally_valid_path_after_projection","dependency_result_hash":"sha256:c9fc029fe9d38ed1e6c794665c1763e0f59aeed1bbb83dac05575507efed9cb0","diagnostics":[],"normalized_ir_hash":"sha256:bcc6c98cd8d4d2e5813bd880d0f32e9afb70eeeb6ed4a0ec969493df73752fbb","projected_ir_hash":"sha256:581d11b3f77a71897233a077df5616db696c67f6b0aa75c32b3c6c5b04d05663","reachability_result_hash":"sha256:aafa8dffbb84e99330347267e2b971361346b2cbcb90c9351c278269ee7ba98b","reachable_after_projection":["cli","plugin_command_discovery","selected_php_execution","version_resolution"],"roots":["cli"],"schema_version":"dependency-algebra.dependency.v1","target":"php_installation","workload_id":"bundled-install-requires-builder"},{"candidate_set":["build_configuration","bundled_installer"],"dependency":false,"dependency_reason":"structurally_valid_path_remaining_after_projection","dependency_result_hash":"sha256:df329e790b06ca4b2296fd3226b4235234c3b7788754ef6ce88883cd2a84a2bf","diagnostics":[],"normalized_ir_hash":"sha256:bcc6c98cd8d4d2e5813bd880d0f32e9afb70eeeb6ed4a0ec969493df73752fbb","projected_ir_hash":"sha256:581d11b3f77a71897233a077df5616db696c67f6b0aa75c32b3c6c5b04d05663","reachability_result_hash":"sha256:1dcc74115a67be9e3472346088a6a71d4b882add4a291b6d1def17e0f85933a2","reachable_after_projection":["cli","plugin_command_discovery","selected_php_execution","version_resolution"],"roots":["cli"],"schema_version":"dependency-algebra.dependency.v1","target":"selected_php_execution","workload_id":"execute-installed-php-without-bundled-builder"}],"diagnostics":[],"errors":[],"failure_surface":[{"candidate_set":["build_configuration","bundled_installer"],"dependency":true,"dependency_reason":"no_structurally_valid_path_after_projection","dependency_result_hash":"sha256:c9fc029fe9d38ed1e6c794665c1763e0f59aeed1bbb83dac05575507efed9cb0","diagnostics":[],"normalized_ir_hash":"sha256:bcc6c98cd8d4d2e5813bd880d0f32e9afb70eeeb6ed4a0ec969493df73752fbb","projected_ir_hash":"sha256:581d11b3f77a71897233a077df5616db696c67f6b0aa75c32b3c6c5b04d05663","reachability_result_hash":"sha256:aafa8dffbb84e99330347267e2b971361346b2cbcb90c9351c278269ee7ba98b","reachable_after_projection":["cli","plugin_command_discovery","selected_php_execution","version_resolution"],"roots":["cli"],"schema_version":"dependency-algebra.dependency.v1","target":"php_installation","workload_id":"bundled-install-requires-builder"}],"input_hash":"sha256:8c409c9285275d4065931d46f4a57154ec5845400fadbe72b5f248721cf93ebc","k_of_n_resilience_profile":{"bundled-install-requires-builder":{"candidate_count":2,"reachable_after_projection_count":4},"execute-installed-php-without-bundled-builder":{"candidate_count":2,"reachable_after_projection_count":4}},"normalized_ir_hash":"sha256:bcc6c98cd8d4d2e5813bd880d0f32e9afb70eeeb6ed4a0ec969493df73752fbb","package_version":"0.1.0","provenance":{"analysis_result_hash":"sha256:79c02cdff29ef91152c4f66b6a80212e7dac015d68311ced321f58bb8574a144","pipeline":["parse_topology","validate_and_normalize","analyze","emit_artifact"],"source_id":"input"},"reachability_graph":{"normalized_ir_hash":"sha256:bcc6c98cd8d4d2e5813bd880d0f32e9afb70eeeb6ed4a0ec969493df73752fbb","reachability_result_hash":"sha256:323e02a8339f3311740994d666b2c32fbcf19d2754b0902e9723a93b72828d6f","results":[{"diagnostics":[],"reachable":true,"reached_by":["cli"],"roots":["cli"],"target":"php_installation","traversal_edges":[{"edge_id":"cli-discovers-plugin-commands","from":"cli","to":"plugin_command_discovery"},{"edge_id":"cli-dispatches-installer","from":"cli","to":"bundled_installer"},{"edge_id":"cli-resolves-version","from":"cli","to":"version_resolution"},{"edge_id":"config-produces-install","from":"build_configuration","to":"php_installation"},{"edge_id":"installer-reads-config","from":"bundled_installer","to":"build_configuration"},{"edge_id":"version-runs-php","from":"version_resolution","to":"selected_php_execution"}],"visited_nodes":["build_configuration","bundled_installer","cli","php_installation","plugin_command_discovery","selected_php_execution","version_resolution"],"workload_id":"bundled-install-requires-builder"},{"diagnostics":[],"reachable":true,"reached_by":["cli"],"roots":["cli"],"target":"selected_php_execution","traversal_edges":[{"edge_id":"cli-discovers-plugin-commands","from":"cli","to":"plugin_command_discovery"},{"edge_id":"cli-dispatches-installer","from":"cli","to":"bundled_installer"},{"edge_id":"cli-resolves-version","from":"cli","to":"version_resolution"},{"edge_id":"config-produces-install","from":"build_configuration","to":"php_installation"},{"edge_id":"installer-reads-config","from":"bundled_installer","to":"build_configuration"},{"edge_id":"version-runs-php","from":"version_resolution","to":"selected_php_execution"}],"visited_nodes":["build_configuration","bundled_installer","cli","php_installation","plugin_command_discovery","selected_php_execution","version_resolution"],"workload_id":"execute-installed-php-without-bundled-builder"}],"schema_version":"dependency-algebra.reachability.v1","topology_id":"phpenv-08f1322-build-delegation"},"redundancy_map":{"bundled-install-requires-builder":{"candidate_set":["build_configuration","bundled_installer"],"dependency":true,"dependency_reason":"no_structurally_valid_path_after_projection"},"execute-installed-php-without-bundled-builder":{"candidate_set":["build_configuration","bundled_installer"],"dependency":false,"dependency_reason":"structurally_valid_path_remaining_after_projection"}},"source_topology_schema_version":"dependency-algebra.topology.v1","warnings":[]}